{
  "required" : true ,
  "$schema" : "http://json-schema.org/draft-03/schema" ,
  "type" : "object" ,
  "properties" : {
    "startAt" : {
      "type" : "string" ,
      "required" : false
    } ,
    "endAt" : {
      "type" : "string" ,
      "required" : false
    } ,
    "budgetedCost" : {
      "type" : "string" ,
      "required" : false
    } ,
    "actualCost" : {
      "type" : "string" ,
      "required" : false
    } ,
    "isMemberAllowedReEntry" : {
      "type" : "string" ,
      "required" : false
    } ,
    "fieldValues" : {
      "type" : "array" ,
      "required" : false ,
      "items" : [
        {
          "type" : "object" ,
          "properties" : {
            "value" : {
              "type" : "string" ,
              "required" : false
            } ,
            "id" : {
              "type" : "string" ,
              "required" : false
            }
          }
        }
      ]
    } ,
    "elements" : {
      "type" : "array" ,
      "required" : false ,
      "items" : [
        {
          "type" : "object" ,
          "properties" : {
            "position" : {
              "type" : "object" ,
              "required" : false
            } ,
            "outputTerminals" : {
              "type" : "array" ,
              "required" : false ,
              "items" : [
                {
                  "type" : "object" ,
                  "properties" : {
                    "terminalType" : {
                      "type" : "string" ,
                      "required" : false
                    } ,
                    "connectedType" : {
                      "type" : "string" ,
                      "required" : false
                    } ,
                    "connectedId" : {
                      "type" : "string" ,
                      "required" : false
                    } ,
                    "name" : {
                      "type" : "string" ,
                      "required" : false
                    } ,
                    "description" : {
                      "type" : "string" ,
                      "required" : false
                    } ,
                    "permissions" : {
                      "type" : "string" ,
                      "required" : false
                    } ,
                    "folderId" : {
                      "type" : "string" ,
                      "required" : false
                    } ,
                    "sourceTemplateId" : {
                      "type" : "string" ,
                      "required" : false
                    } ,
                    "createdBy" : {
                      "type" : "string" ,
                      "required" : false
                    } ,
                    "createdAt" : {
                      "type" : "string" ,
                      "required" : false
                    } ,
                    "updatedBy" : {
                      "type" : "string" ,
                      "required" : false
                    } ,
                    "updatedAt" : {
                      "type" : "string" ,
                      "required" : false
                    } ,
                    "accessedAt" : {
                      "type" : "string" ,
                      "required" : false
                    } ,
                    "scheduledFor" : {
                      "type" : "string" ,
                      "required" : false
                    } ,
                    "depth" : {
                      "type" : "string" ,
                      "required" : false
                    }
                  }
                }
              ]
            } ,
            "name" : {
              "type" : "string" ,
              "required" : false
            } ,
            "description" : {
              "type" : "string" ,
              "required" : false
            } ,
            "permissions" : {
              "type" : "string" ,
              "required" : false
            } ,
            "folderId" : {
              "type" : "string" ,
              "required" : false
            } ,
            "sourceTemplateId" : {
              "type" : "string" ,
              "required" : false
            } ,
            "createdBy" : {
              "type" : "string" ,
              "required" : false
            } ,
            "createdAt" : {
              "type" : "string" ,
              "required" : false
            } ,
            "updatedBy" : {
              "type" : "string" ,
              "required" : false
            } ,
            "updatedAt" : {
              "type" : "string" ,
              "required" : false
            } ,
            "accessedAt" : {
              "type" : "string" ,
              "required" : false
            } ,
            "scheduledFor" : {
              "type" : "string" ,
              "required" : false
            } ,
            "depth" : {
              "type" : "string" ,
              "required" : false
            }
          }
        }
      ]
    } ,
    "isReadOnly" : {
      "type" : "string" ,
      "required" : false
    } ,
    "campaignType" : {
      "type" : "string" ,
      "required" : false
    } ,
    "product" : {
      "type" : "string" ,
      "required" : false
    } ,
    "region" : {
      "type" : "string" ,
      "required" : false
    } ,
    "crmId" : {
      "type" : "string" ,
      "required" : false
    } ,
    "name" : {
      "type" : "string" ,
      "required" : false
    } ,
    "description" : {
      "type" : "string" ,
      "required" : false
    } ,
    "permissions" : {
      "type" : "string" ,
      "required" : false
    } ,
    "folderId" : {
      "type" : "string" ,
      "required" : false
    } ,
    "sourceTemplateId" : {
      "type" : "string" ,
      "required" : false
    } ,
    "createdBy" : {
      "type" : "string" ,
      "required" : false
    } ,
    "createdAt" : {
      "type" : "string" ,
      "required" : false
    } ,
    "updatedBy" : {
      "type" : "string" ,
      "required" : false
    } ,
    "updatedAt" : {
      "type" : "string" ,
      "required" : false
    } ,
    "accessedAt" : {
      "type" : "string" ,
      "required" : false
    } ,
    "scheduledFor" : {
      "type" : "string" ,
      "required" : false
    } ,
    "depth" : {
      "type" : "string" ,
      "required" : false
    }
  }
}